{
  "schema_version": "1.1.0",
  "updated_on": "2026-09-19",
  "terms": [
    {
      "id": "TERM-0001",
      "term": "Modèle",
      "english_term": "Model",
      "slug": "modele",
      "aliases": [
        "modèle d'IA"
      ],
      "definition_short": "Composant appris qui transforme des entrées en sorties selon une architecture et des paramètres déterminés.",
      "definition_precise": "Dans un système d'apprentissage automatique, un modèle est une structure computationnelle dont le comportement dépend notamment de son architecture et de paramètres appris à partir de données. Le modèle n'est pas, à lui seul, nécessairement une application complète.",
      "pedagogical_analogy": "Le modèle peut être comparé au moteur d'un véhicule : il joue un rôle central, mais le véhicule complet comporte de nombreux autres composants.",
      "analogy_limits": "Un modèle n'est pas un mécanisme mécanique indépendant de ses données, de son environnement logiciel et de ses modalités d'utilisation. L'analogie avec un moteur sert uniquement à distinguer composant et système complet.",
      "not_to_confuse_with": [
        "TERM-0002",
        "TERM-0003",
        "TERM-0004"
      ],
      "common_misuses": [
        {
          "statement": "Employer indifféremment modèle et application.",
          "correction": "À corriger avec la définition canonique : Composant appris qui transforme des entrées en sorties selon une architecture et des paramètres déterminés."
        },
        {
          "statement": "Attribuer au modèle toutes les capacités visibles dans un produit.",
          "correction": "À corriger avec la définition canonique : Composant appris qui transforme des entrées en sorties selon une architecture et des paramètres déterminés."
        }
      ],
      "stability": "stable",
      "epistemic_status": "established",
      "source_ids": [
        "SRC-0001",
        "SRC-0008"
      ],
      "tags": [
        "model",
        "architecture",
        "foundations"
      ],
      "reviewed_on": "2026-09-17"
    },
    {
      "id": "TERM-0002",
      "term": "Système d'IA",
      "english_term": "AI system",
      "slug": "systeme-ia",
      "aliases": [
        "système d'intelligence artificielle"
      ],
      "definition_short": "Système basé sur une machine qui infère, à partir des entrées reçues et d'objectifs explicites ou implicites, comment produire des sorties.",
      "definition_precise": "La définition de référence de l'OCDE décrit un système d'IA comme un système basé sur une machine qui, pour des objectifs explicites ou implicites, infère à partir des entrées reçues comment générer des sorties telles que prédictions, contenus, recommandations ou décisions susceptibles d'influencer des environnements physiques ou virtuels.",
      "pedagogical_analogy": "Le système d'IA correspond davantage au véhicule complet qu'à son seul moteur.",
      "analogy_limits": "Un système d'IA peut avoir une architecture logicielle bien plus distribuée qu'un objet physique et peut intégrer plusieurs modèles, services, bases de données ou outils.",
      "not_to_confuse_with": [
        "TERM-0001",
        "TERM-0003"
      ],
      "common_misuses": [
        {
          "statement": "Réduire tout système d'IA à son modèle neuronal.",
          "correction": "À corriger avec la définition canonique : Système basé sur une machine qui infère, à partir des entrées reçues et d'objectifs explicites ou implicites, comment produire des sorties."
        },
        {
          "statement": "Employer IA uniquement pour désigner les chatbots génératifs.",
          "correction": "À corriger avec la définition canonique : Système basé sur une machine qui infère, à partir des entrées reçues et d'objectifs explicites ou implicites, comment produire des sorties."
        }
      ],
      "stability": "evolving",
      "epistemic_status": "established",
      "source_ids": [
        "SRC-0001"
      ],
      "tags": [
        "ai-system",
        "definition",
        "architecture"
      ],
      "reviewed_on": "2026-09-17"
    },
    {
      "id": "TERM-0003",
      "term": "Application",
      "english_term": "Application",
      "slug": "application",
      "definition_short": "Produit logiciel destiné à un usage concret et pouvant intégrer un ou plusieurs modèles ainsi que d'autres composants.",
      "definition_precise": "Dans le contexte de l'IA, une application est un système logiciel mis à disposition d'un utilisateur ou d'un autre système. Elle peut associer un modèle à une interface, des instructions, une gestion du contexte, des outils, des sources de données, de la mémoire applicative, du code métier et des mécanismes de sécurité.",
      "pedagogical_analogy": "Si le modèle est le moteur, l'application est le véhicule utilisable avec son tableau de bord, ses commandes et ses équipements.",
      "analogy_limits": "La frontière entre application et système dépend de l'échelle d'analyse ; une application peut elle-même être un composant d'un système plus large.",
      "not_to_confuse_with": [
        "TERM-0001",
        "TERM-0002",
        "TERM-0004"
      ],
      "common_misuses": [
        {
          "statement": "Prendre le nom commercial d'une application pour le nom exact du modèle qu'elle utilise.",
          "correction": "À corriger avec la définition canonique : Produit logiciel destiné à un usage concret et pouvant intégrer un ou plusieurs modèles ainsi que d'autres composants."
        },
        {
          "statement": "Supposer que recherche web, mémoire ou outils sont nécessairement des capacités intrinsèques du modèle.",
          "correction": "À corriger avec la définition canonique : Produit logiciel destiné à un usage concret et pouvant intégrer un ou plusieurs modèles ainsi que d'autres composants."
        }
      ],
      "stability": "stable",
      "epistemic_status": "established",
      "source_ids": [
        "SRC-0001",
        "SRC-0003"
      ],
      "tags": [
        "application",
        "product",
        "architecture"
      ],
      "reviewed_on": "2026-09-17"
    },
    {
      "id": "TERM-0004",
      "term": "Chatbot",
      "english_term": "Chatbot",
      "slug": "chatbot",
      "aliases": [
        "assistant conversationnel",
        "interface conversationnelle"
      ],
      "definition_short": "Application ou interface permettant une interaction avec un utilisateur sous forme conversationnelle.",
      "definition_precise": "Un chatbot organise une interaction sous forme de dialogue. Les chatbots modernes peuvent utiliser un LLM comme composant principal, mais le caractère conversationnel appartient au système ou à l'application et ne définit pas à lui seul le modèle sous-jacent.",
      "pedagogical_analogy": "Le chatbot est le guichet avec lequel l'utilisateur dialogue ; le modèle est l'un des mécanismes qui peuvent fonctionner derrière ce guichet.",
      "analogy_limits": "Un chatbot peut intégrer de nombreux autres composants et certains systèmes conversationnels historiques n'utilisent aucun LLM.",
      "not_to_confuse_with": [
        "TERM-0001",
        "TERM-0003"
      ],
      "common_misuses": [
        {
          "statement": "Employer chatbot et LLM comme synonymes.",
          "correction": "À corriger avec la définition canonique : Application ou interface permettant une interaction avec un utilisateur sous forme conversationnelle."
        },
        {
          "statement": "Supposer que tout LLM possède nécessairement une interface conversationnelle.",
          "correction": "À corriger avec la définition canonique : Application ou interface permettant une interaction avec un utilisateur sous forme conversationnelle."
        }
      ],
      "stability": "stable",
      "epistemic_status": "established",
      "source_ids": [
        "SRC-0003"
      ],
      "tags": [
        "chatbot",
        "conversation",
        "interface"
      ],
      "reviewed_on": "2026-09-17"
    },
    {
      "id": "TERM-0005",
      "term": "Paramètre",
      "english_term": "Parameter",
      "slug": "parametre",
      "aliases": [
        "paramètre appris"
      ],
      "definition_short": "Valeur numérique d'un modèle ajustée pendant l'entraînement.",
      "definition_precise": "Un paramètre est une valeur numérique appartenant au modèle et généralement optimisée au cours de l'entraînement afin de réduire une fonction de perte. Les réseaux neuronaux modernes peuvent comporter un très grand nombre de paramètres.",
      "pedagogical_analogy": "On peut imaginer des millions ou milliards de petits réglages numériques ajustés progressivement pendant l'apprentissage.",
      "analogy_limits": "Ces réglages ne correspondent généralement pas chacun à une connaissance, un mot ou une règle identifiable isolément.",
      "not_to_confuse_with": [
        "TERM-0006"
      ],
      "common_misuses": [
        {
          "statement": "Imaginer qu'un paramètre contient directement une phrase ou un fait.",
          "correction": "À corriger avec la définition canonique : Valeur numérique d'un modèle ajustée pendant l'entraînement."
        },
        {
          "statement": "Assimiler nombre de paramètres et intelligence.",
          "correction": "À corriger avec la définition canonique : Valeur numérique d'un modèle ajustée pendant l'entraînement."
        }
      ],
      "stability": "stable",
      "epistemic_status": "established",
      "source_ids": [
        "SRC-0002",
        "SRC-0008"
      ],
      "tags": [
        "parameters",
        "training",
        "neural-networks"
      ],
      "reviewed_on": "2026-09-17"
    },
    {
      "id": "TERM-0006",
      "term": "Poids",
      "english_term": "Weight",
      "slug": "poids",
      "aliases": [
        "weight",
        "poids du modèle"
      ],